results/preparation/missing_values.csv

table,column,total_rows,null_count,empty_count,missing_count,missing_pct
name.basics,nconst,15765984,0,0,0,0.0
name.basics,primaryName,15765984,87,0,87,0.0
name.basics,birthYear,15765984,15081377,0,15081377,95.66
name.basics,deathYear,15765984,15501152,0,15501152,98.32
name.basics,primaryProfession,15765984,3203725,0,3203725,20.32
name.basics,knownForTitles,15765984,1909359,0,1909359,12.11
title.akas,titleId,59949689,0,0,0,0.0
title.akas,ordering,59949689,0,0,0,0.0
title.akas,title,59949689,0,0,0,0.0
title.akas,region,59949689,12939076,0,12939076,21.58
title.akas,language,59949689,19549363,0,19549363,32.61
title.akas,types,59949689,40116604,0,40116604,66.92
title.akas,attributes,59949689,59633311,0,59633311,99.47
title.akas,isOriginalTitle,59949689,0,0,0,0.0
title.basics,tconst,12898691,0,0,0,0.0
title.basics,titleType,12898691,0,0,0,0.0
title.basics,primaryTitle,12898691,0,0,0,0.0
title.basics,originalTitle,12898691,0,0,0,0.0
title.basics,isAdult,12898691,0,0,0,0.0
title.basics,startYear,12898691,1487504,0,1487504,11.53
title.basics,endYear,12898691,12735133,0,12735133,98.73
title.basics,runtimeMinutes,12898691,8033359,0,8033359,62.28
title.basics,genres,12898691,547433,0,547433,4.24
title.crew,tconst,12898691,0,0,0,0.0
title.crew,directors,12898691,5746998,0,5746998,44.55
title.crew,writers,12898691,6387208,0,6387208,49.52
title.episode,tconst,9978123,0,0,0,0.0
title.episode,parentTconst,9978123,0,0,0,0.0
title.episode,seasonNumber,9978123,2096402,0,2096402,21.01
title.episode,episodeNumber,9978123,2096402,0,2096402,21.01
title.principals,tconst,102512651,0,0,0,0.0
title.principals,ordering,102512651,0,0,0,0.0
title.principals,nconst,102512651,0,0,0,0.0
title.principals,category,102512651,0,0,0,0.0
title.principals,job,102512651,82720617,0,82720617,80.69
title.principals,characters,102512651,52510212,0,52510212,51.22
title.ratings,tconst,1725891,0,0,0,0.0
title.ratings,averageRating,1725891,0,0,0,0.0
title.ratings,numVotes,1725891,0,0,0,0.0

REPORT.md

### 1.1 Null and Missing Values per Column

Certain columns will have a direct impact on the exploration phase as `runtimeMinutes` (62.28%) for question 2.1, regarding film durations, `startYear` (11.53%) for questions involving years (2.2 and 2.3), `directors` (44.55%) for question 2.4, regarding directors, `genres` (4.24%) for all questions involving genres.

`characters` has a null rate of 51.22%: individuals who are not actors (such as directors, composers, etc.) do not have an associated character.